{"generated_at":"2026-09-25T00:00:00Z","links":[{"bandwidth_bps":500000000.0,"destination":"edge-01","energy_joules_per_gb":12.0,"link_id":"far-01-edge-01","propagation_latency_ms":5.0,"provenance":"simulated","source":"far-01","transfer_cost_per_gb":0.005},{"bandwidth_bps":500000000.0,"destination":"edge-02","energy_joules_per_gb":12.0,"link_id":"far-01-edge-02","propagation_latency_ms":7.0,"provenance":"simulated","source":"far-01","transfer_cost_per_gb":0.005},{"bandwidth_bps":500000000.0,"destination":"edge-02","energy_joules_per_gb":12.0,"link_id":"far-02-edge-02","propagation_latency_ms":5.0,"provenance":"simulated","source":"far-02","transfer_cost_per_gb":0.005},{"bandwidth_bps":500000000.0,"destination":"edge-03","energy_joules_per_gb":12.0,"link_id":"far-02-edge-03","propagation_latency_ms":7.0,"provenance":"simulated","source":"far-02","transfer_cost_per_gb":0.005},{"bandwidth_bps":500000000.0,"destination":"edge-03","energy_joules_per_gb":12.0,"link_id":"far-03-edge-03","propagation_latency_ms":5.0,"provenance":"simulated","source":"far-03","transfer_cost_per_gb":0.005},{"bandwidth_bps":500000000.0,"destination":"edge-04","energy_joules_per_gb":12.0,"link_id":"far-03-edge-04","propagation_latency_ms":7.0,"provenance":"simulated","source":"far-03","transfer_cost_per_gb":0.005},{"bandwidth_bps":500000000.0,"destination":"edge-04","energy_joules_per_gb":12.0,"link_id":"far-04-edge-04","propagation_latency_ms":5.0,"provenance":"simulated","source":"far-04","transfer_cost_per_gb":0.005},{"bandwidth_bps":500000000.0,"destination":"edge-05","energy_joules_per_gb":12.0,"link_id":"far-04-edge-05","propagation_latency_ms":7.0,"provenance":"simulated","source":"far-04","transfer_cost_per_gb":0.005},{"bandwidth_bps":500000000.0,"destination":"edge-05","energy_joules_per_gb":12.0,"link_id":"far-05-edge-05","propagation_latency_ms":5.0,"provenance":"simulated","source":"far-05","transfer_cost_per_gb":0.005},{"bandwidth_bps":500000000.0,"destination":"edge-06","energy_joules_per_gb":12.0,"link_id":"far-05-edge-06","propagation_latency_ms":7.0,"provenance":"simulated","source":"far-05","transfer_cost_per_gb":0.005},{"bandwidth_bps":500000000.0,"destination":"edge-06","energy_joules_per_gb":12.0,"link_id":"far-06-edge-06","propagation_latency_ms":5.0,"provenance":"simulated","source":"far-06","transfer_cost_per_gb":0.005},{"bandwidth_bps":500000000.0,"destination":"edge-07","energy_joules_per_gb":12.0,"link_id":"far-06-edge-07","propagation_latency_ms":7.0,"provenance":"simulated","source":"far-06","transfer_cost_per_gb":0.005},{"bandwidth_bps":500000000.0,"destination":"edge-07","energy_joules_per_gb":12.0,"link_id":"far-07-edge-07","propagation_latency_ms":5.0,"provenance":"simulated","source":"far-07","transfer_cost_per_gb":0.005},{"bandwidth_bps":500000000.0,"destination":"edge-08","energy_joules_per_gb":12.0,"link_id":"far-07-edge-08","propagation_latency_ms":7.0,"provenance":"simulated","source":"far-07","transfer_cost_per_gb":0.005},{"bandwidth_bps":500000000.0,"destination":"edge-08","energy_joules_per_gb":12.0,"link_id":"far-08-edge-08","propagation_latency_ms":5.0,"provenance":"simulated","source":"far-08","transfer_cost_per_gb":0.005},{"bandwidth_bps":500000000.0,"destination":"edge-01","energy_joules_per_gb":12.0,"link_id":"far-08-edge-01","propagation_latency_ms":7.0,"provenance":"simulated","source":"far-08","transfer_cost_per_gb":0.005},{"bandwidth_bps":500000000.0,"destination":"edge-01","energy_joules_per_gb":12.0,"link_id":"far-09-edge-01","propagation_latency_ms":5.0,"provenance":"simulated","source":"far-09","transfer_cost_per_gb":0.005},{"bandwidth_bps":500000000.0,"destination":"edge-02","energy_joules_per_gb":12.0,"link_id":"far-09-edge-02","propagation_latency_ms":7.0,"provenance":"simulated","source":"far-09","transfer_cost_per_gb":0.005},{"bandwidth_bps":500000000.0,"destination":"edge-02","energy_joules_per_gb":12.0,"link_id":"far-10-edge-02","propagation_latency_ms":5.0,"provenance":"simulated","source":"far-10","transfer_cost_per_gb":0.005},{"bandwidth_bps":500000000.0,"destination":"edge-03","energy_joules_per_gb":12.0,"link_id":"far-10-edge-03","propagation_latency_ms":7.0,"provenance":"simulated","source":"far-10","transfer_cost_per_gb":0.005},{"bandwidth_bps":500000000.0,"destination":"edge-03","energy_joules_per_gb":12.0,"link_id":"far-11-edge-03","propagation_latency_ms":5.0,"provenance":"simulated","source":"far-11","transfer_cost_per_gb":0.005},{"bandwidth_bps":500000000.0,"destination":"edge-04","energy_joules_per_gb":12.0,"link_id":"far-11-edge-04","propagation_latency_ms":7.0,"provenance":"simulated","source":"far-11","transfer_cost_per_gb":0.005},{"bandwidth_bps":500000000.0,"destination":"edge-04","energy_joules_per_gb":12.0,"link_id":"far-12-edge-04","propagation_latency_ms":5.0,"provenance":"simulated","source":"far-12","transfer_cost_per_gb":0.005},{"bandwidth_bps":500000000.0,"destination":"edge-05","energy_joules_per_gb":12.0,"link_id":"far-12-edge-05","propagation_latency_ms":7.0,"provenance":"simulated","source":"far-12","transfer_cost_per_gb":0.005},{"bandwidth_bps":500000000.0,"destination":"edge-05","energy_joules_per_gb":12.0,"link_id":"far-13-edge-05","propagation_latency_ms":5.0,"provenance":"simulated","source":"far-13","transfer_cost_per_gb":0.005},{"bandwidth_bps":500000000.0,"destination":"edge-06","energy_joules_per_gb":12.0,"link_id":"far-13-edge-06","propagation_latency_ms":7.0,"provenance":"simulated","source":"far-13","transfer_cost_per_gb":0.005},{"bandwidth_bps":500000000.0,"destination":"edge-06","energy_joules_per_gb":12.0,"link_id":"far-14-edge-06","propagation_latency_ms":5.0,"provenance":"simulated","source":"far-14","transfer_cost_per_gb":0.005},{"bandwidth_bps":500000000.0,"destination":"edge-07","energy_joules_per_gb":12.0,"link_id":"far-14-edge-07","propagation_latency_ms":7.0,"provenance":"simulated","source":"far-14","transfer_cost_per_gb":0.005},{"bandwidth_bps":500000000.0,"destination":"edge-07","energy_joules_per_gb":12.0,"link_id":"far-15-edge-07","propagation_latency_ms":5.0,"provenance":"simulated","source":"far-15","transfer_cost_per_gb":0.005},{"bandwidth_bps":500000000.0,"destination":"edge-08","energy_joules_per_gb":12.0,"link_id":"far-15-edge-08","propagation_latency_ms":7.0,"provenance":"simulated","source":"far-15","transfer_cost_per_gb":0.005},{"bandwidth_bps":500000000.0,"destination":"edge-08","energy_joules_per_gb":12.0,"link_id":"far-16-edge-08","propagation_latency_ms":5.0,"provenance":"simulated","source":"far-16","transfer_cost_per_gb":0.005},{"bandwidth_bps":500000000.0,"destination":"edge-01","energy_joules_per_gb":12.0,"link_id":"far-16-edge-01","propagation_latency_ms":7.0,"provenance":"simulated","source":"far-16","transfer_cost_per_gb":0.005},{"bandwidth_bps":500000000.0,"destination":"edge-01","energy_joules_per_gb":12.0,"link_id":"far-17-edge-01","propagation_latency_ms":5.0,"provenance":"simulated","source":"far-17","transfer_cost_per_gb":0.005},{"bandwidth_bps":500000000.0,"destination":"edge-02","energy_joules_per_gb":12.0,"link_id":"far-17-edge-02","propagation_latency_ms":7.0,"provenance":"simulated","source":"far-17","transfer_cost_per_gb":0.005},{"bandwidth_bps":500000000.0,"destination":"edge-02","energy_joules_per_gb":12.0,"link_id":"far-18-edge-02","propagation_latency_ms":5.0,"provenance":"simulated","source":"far-18","transfer_cost_per_gb":0.005},{"bandwidth_bps":500000000.0,"destination":"edge-03","energy_joules_per_gb":12.0,"link_id":"far-18-edge-03","propagation_latency_ms":7.0,"provenance":"simulated","source":"far-18","transfer_cost_per_gb":0.005},{"bandwidth_bps":500000000.0,"destination":"edge-03","energy_joules_per_gb":12.0,"link_id":"far-19-edge-03","propagation_latency_ms":5.0,"provenance":"simulated","source":"far-19","transfer_cost_per_gb":0.005},{"bandwidth_bps":500000000.0,"destination":"edge-04","energy_joules_per_gb":12.0,"link_id":"far-19-edge-04","propagation_latency_ms":7.0,"provenance":"simulated","source":"far-19","transfer_cost_per_gb":0.005},{"bandwidth_bps":500000000.0,"destination":"edge-04","energy_joules_per_gb":12.0,"link_id":"far-20-edge-04","propagation_latency_ms":5.0,"provenance":"simulated","source":"far-20","transfer_cost_per_gb":0.005},{"bandwidth_bps":500000000.0,"destination":"edge-05","energy_joules_per_gb":12.0,"link_id":"far-20-edge-05","propagation_latency_ms":7.0,"provenance":"simulated","source":"far-20","transfer_cost_per_gb":0.005},{"bandwidth_bps":2000000000.0,"destination":"edge-02","energy_joules_per_gb":8.0,"link_id":"edge-01-edge-02","propagation_latency_ms":3.0,"provenance":"simulated","source":"edge-01","transfer_cost_per_gb":0.002},{"bandwidth_bps":10000000000.0,"destination":"cloud-01","energy_joules_per_gb":6.0,"link_id":"edge-01-cloud-01","propagation_latency_ms":8.0,"provenance":"simulated","source":"edge-01","transfer_cost_per_gb":0.001},{"bandwidth_bps":2000000000.0,"destination":"edge-03","energy_joules_per_gb":8.0,"link_id":"edge-02-edge-03","propagation_latency_ms":3.0,"provenance":"simulated","source":"edge-02","transfer_cost_per_gb":0.002},{"bandwidth_bps":10000000000.0,"destination":"cloud-02","energy_joules_per_gb":6.0,"link_id":"edge-02-cloud-02","propagation_latency_ms":8.0,"provenance":"simulated","source":"edge-02","transfer_cost_per_gb":0.001},{"bandwidth_bps":2000000000.0,"destination":"edge-04","energy_joules_per_gb":8.0,"link_id":"edge-03-edge-04","propagation_latency_ms":3.0,"provenance":"simulated","source":"edge-03","transfer_cost_per_gb":0.002},{"bandwidth_bps":10000000000.0,"destination":"cloud-03","energy_joules_per_gb":6.0,"link_id":"edge-03-cloud-03","propagation_latency_ms":8.0,"provenance":"simulated","source":"edge-03","transfer_cost_per_gb":0.001},{"bandwidth_bps":2000000000.0,"destination":"edge-05","energy_joules_per_gb":8.0,"link_id":"edge-04-edge-05","propagation_latency_ms":3.0,"provenance":"simulated","source":"edge-04","transfer_cost_per_gb":0.002},{"bandwidth_bps":10000000000.0,"destination":"cloud-04","en